equipo,concepto,valor_moneda_origen,moneda_origen,valor_eur,unidad,fuente,url,soporte
reach_truck,alquiler_mensual,520.0,GBP,597.75,GBP/mes,Multy Lift Caterpillar NR20NH (3919),https://www.multylift.co.uk/caterpillar-nr20nh-3919/,Reach truck usado ofertado con hire mensual.
reach_truck,compra_usada,8500.0,GBP,9770.9,GBP,Multy Lift Caterpillar NR20NH (3919),https://www.multylift.co.uk/caterpillar-nr20nh-3919/,Precio contado reach truck usado.
articulated_truck,alquiler_mensual,1018.0,GBP,1170.21,GBP/mes,Multy Lift Aisle Master Forklift Hire,https://www.multylift.co.uk/aisle-master-forklift-hire/,Aisle Master articulada/VNA en hire mensual.
articulated_truck,compra_usada,14450.0,GBP,16610.53,GBP,Trucks Direct UK Aisle Master sold archive,https://www.trucksdirectuk.co.uk/c/aisle-master-sold-archive,Aisle Master articulada usada vendida.
articulated_truck,compra_nueva_desde,29899.0,GBP,34369.43,GBP,Trucks Direct UK Aisle Master / articulated,https://www.trucksdirectuk.co.uk/c/new-forklifts/aisle-master-forklift,Articulada nueva desde precio catálogo.
